disease_name,url,symptoms
Craniosynostosis,https://www.mayoclinic.org/diseases-conditions/craniosynostosis/symptoms-causes/syc-20354513,"Symptoms of craniosynostosis usually can be seen at birth. They become easier to see during the first few months of a baby's life.; Symptoms and their severity depend on how many sutures are closed and when the closing occurs during brain development. Symptoms can include:; A skull with a shape that's not typical. Shape depends on which of the sutures are closed. The brain keeps growing on the sides with open sutures, changing the shape of the head.; Change in the balance of facial features and ears. For example, one eye may be higher than the other.; A raised, hard ridge along the closed cranial suture."
Creutzfeldt-Jakob disease,https://www.mayoclinic.org/diseases-conditions/creutzfeldt-jakob-disease/symptoms-causes/syc-20371226,"Creutzfeldt-Jakob disease is marked by changes in mental abilities. Symptoms get worse quickly, usually within several weeks to a few months. Early symptoms include:; Personality changes.; Memory loss.; Impaired thinking.; Blurry vision or blindness.; Insomnia.; Problems with coordination.; Trouble speaking.; Trouble swallowing.; Sudden, jerky movements.; Death usually occurs within a year. People with Creutzfeldt-Jakob disease usually die of medical issues associated with the disease. They might include having trouble swallowing, falls, heart issues, lung failure, or pneumonia or other infections.; In people with variant CJD , changes in mental abilities may be more apparent in the beginning of the disease. In many cases, dementia develops later in the illness. Symptoms of dementia include the loss of the ability to think, reason and remember.; Variant CJD affects people at a younger age than CJD . Variant CJD appears to last 12 to 14 months.; Another rare form of prion disease is called variably protease-sensitive prionopathy (VPSPr). It can mimic other forms of dementia. It causes changes in mental abilities and problems with speech and thinking. The course of the disease is longer than other prion diseases — about 24 months."
Crohn's disease,https://www.mayoclinic.org/diseases-conditions/crohns-disease/symptoms-causes/syc-20353304,
Croup,https://www.mayoclinic.org/diseases-conditions/croup/symptoms-causes/syc-20350348,"Croup often begins as an ordinary cold. If there's enough swelling, irritation and coughing, a child can develop:; Loud barking cough that's made worse by crying and coughing, as well as anxiety and distress, setting up a cycle of worsening symptoms.; Fever.; Hoarse voice.; Noisy or labored breathing.; Symptoms of croup are often worse at night and usually last for 3 to 5 days."
Cryoglobulinemia,https://www.mayoclinic.org/diseases-conditions/cryoglobulinemia/symptoms-causes/syc-20371244,"Some people have no symptoms of cryoglobulinemia. For people who have symptoms, the symptoms might come and go. They can include:; Skin spots. Most people with cryoglobulinemia get purple skin spots, called lesions, on their legs. On Black or brown skin, the spots might look black or brown. Some people also get open leg sores, called ulcers.; Joint pain. Symptoms like those of rheumatoid arthritis are common in cryoglobulinemia.; Peripheral neuropathy. Cryoglobulinemia can damage the nerves at the tips of the fingers and toes. This causes numbness and other problems."
CSF leak (Cerebrospinal fluid leak),https://www.mayoclinic.org/diseases-conditions/csf-leak/symptoms-causes/syc-20522246,Symptoms vary between spinal and cranial CSF leaks.
Cushing syndrome,https://www.mayoclinic.org/diseases-conditions/cushing-syndrome/symptoms-causes/syc-20351310,Symptoms of Cushing syndrome can vary depending on the level of extra cortisol.
Cutaneous B-cell lymphoma,https://www.mayoclinic.org/diseases-conditions/cutaneous-b-cell-lymphoma/symptoms-causes/syc-20577439,"Cutaneous B-cell lymphoma usually appears as a lump or group of lumps on the skin that don't go away. Symptoms may include:; A single lump or group of lumps on the skin.; A lump or lumps on the skin that may look pink, purple or red-brown.; Redness around the skin lumps.; Skin lumps that grow slowly.; Cutaneous B-cell lymphomas most often grow on the scalp, forehead or back. Some types of this cancer prefer to grow in other places. Primary cutaneous marginal zone B-cell lymphomas tend to grow on the arms or trunk. Primary cutaneous diffuse large B-cell lymphoma, leg type usually grows on one leg.; Intravascular diffuse large B-cell lymphoma causes symptoms that are different from the other types. The symptoms may include:; Hard skin patches.; Skin around the patches that looks red or purple.; Areas of skin that look like spider veins.; Patches on the trunk or thighs."
Cutaneous T-cell lymphoma,https://www.mayoclinic.org/diseases-conditions/cutaneous-t-cell-lymphoma/symptoms-causes/syc-20351056,"Signs and symptoms of cutaneous T-cell lymphoma include:; Patches of raised or scaly skin that might itch. The patches happen most often on skin that doesn't get much sun.; Patches of skin that look pink, red, brown or gray. The color may be harder to see on Black and brown skin.; Patches of skin that look lighter in color than the skin around them. This may be easier to see on Black and brown skin.; Lumps that form on the skin and may break open.; Lymph nodes that get bigger.; Hair loss.; Thickened skin on the palms of the hands and soles of the feet.; A rash over all the skin that is scaly and itchy."
Cyclic vomiting syndrome,https://www.mayoclinic.org/diseases-conditions/cyclic-vomiting-syndrome/symptoms-causes/syc-20352161,The symptoms of cyclic vomiting syndrome often begin in the morning. Signs and symptoms include:; Three or more recurrent episodes of vomiting that start around the same time and last for a similar length of time; Varying intervals of generally normal health without nausea between episodes; Intense nausea and sweating before an episode starts; Other signs and symptoms during a vomiting episode may include:; Abdominal pain; Diarrhea; Dizziness; Sensitivity to light; Headache; Retching or gagging
Cyclothymia (cyclothymic disorder),https://www.mayoclinic.org/diseases-conditions/cyclothymia/symptoms-causes/syc-20371275,"Cyclothymia symptoms alternate between emotional highs and lows. The highs of cyclothymia include symptoms of an elevated mood (hypomanic symptoms). The lows consist of mild or moderate depressive symptoms.; Cyclothymia symptoms are similar to those of bipolar I or II disorder, but they're less severe. When you have cyclothymia, you can typically function in your daily life, though not always well. The unpredictable nature of your mood shifts may significantly disrupt your life because you never know how you're going to feel."
Cystic fibrosis,https://www.mayoclinic.org/diseases-conditions/cystic-fibrosis/symptoms-causes/syc-20353700,"In the U.S., because of newborn screening, cystic fibrosis can be diagnosed within the first month of life, before symptoms develop. But people born before newborn screening became available may not be diagnosed until the symptoms of CF show up.; CF symptoms vary, depending on which organs are affected and how severe the condition is. Even in the same person, symptoms may worsen or get better at different times. Some people may not have symptoms until their teenage years or adulthood.; People who are not diagnosed until adulthood usually have milder symptoms and are more likely to have symptoms that aren't typical. These may include repeated bouts of an inflamed pancreas called pancreatitis, infertility and repeated bouts of pneumonia.; People with CF have a higher than usual level of salt in their sweat. Parents often can taste the salt when they kiss their children. Most of the other symptoms of CF affect the respiratory system and digestive system."
Cystitis,https://www.mayoclinic.org/diseases-conditions/cystitis/symptoms-causes/syc-20371306,"Cystitis signs and symptoms may include:; A strong, persistent urge to urinate; Pain or a burning feeling when urinating; Passing frequent, small amounts of urine; Blood in the urine (hematuria); Passing cloudy or strong-smelling urine; Pelvic discomfort; A feeling of pressure in the area below your belly button (abdomen); Low-grade fever; In young children, new episodes of accidental daytime wetting also may be a sign of a urinary tract infection (UTI). Nighttime bed-wetting on its own isn't likely to happen because of a UTI ."
Cytomegalovirus (CMV) infection,https://www.mayoclinic.org/diseases-conditions/cmv/symptoms-causes/syc-20355358,"Cytomegalovirus (CMV) infections can cause symptoms such as fever, tiredness and a sore throat. But most healthy people who are infected with CMV have no symptoms.; People who are more likely to have symptoms of a CMV infection include:; Newborns who became infected with CMV before they were born. This condition is called congenital CMV.; Infants who become infected during birth or shortly afterward, also called perinatal CMV. This group includes babies infected through breast milk.; People who have weakened immune systems. This includes people who've had an organ, bone marrow, or stem cell transplant, or those who have HIV.; CMV infection can cause illness when you're first infected. This is called a primary infection. The risk of a baby being born with CMV is higher when the pregnant parent gets a primary infection. If you're healthy, CMV mainly stays dormant. That means the virus doesn't become active and make copies of itself. But in people with weakened immune systems, CMV can become active again when the body's defenses can't keep it dormant."
Dandruff,https://www.mayoclinic.org/diseases-conditions/dandruff/symptoms-causes/syc-20353850,"Dandruff symptoms may include:; Skin flakes on your scalp, hair, eyebrows or shoulders.; Itchy scalp.; Scaly, crusty scalp in infants. This also is called cradle cap.; Dandruff may get worse when you're stressed or during cold, dry weather."
De Quervain tenosynovitis,https://www.mayoclinic.org/diseases-conditions/de-quervain-tenosynovitis/symptoms-causes/syc-20371332,"Symptoms of de Quervain tenosynovitis include:; Pain near the base of the thumb; Swelling near the base of the thumb; Difficulty moving the thumb and wrist when doing something that involves grasping or pinching; A ""sticking"" or ""stop-and-go"" sensation in the thumb when moving it; If the condition goes too long without treatment, the pain may spread farther into the thumb or forearm or both. Moving the thumb and wrist may make the pain worse."
Deep vein thrombosis (DVT),https://www.mayoclinic.org/diseases-conditions/deep-vein-thrombosis/symptoms-causes/syc-20352557,"Deep vein thrombosis (DVT) symptoms can include:; Leg swelling; Leg pain, cramping or soreness that often starts in the calf; Change in skin color on the leg — such as red or purple, depending on the color of your skin; A feeling of warmth on the affected leg; Deep vein thrombosis can occur without noticeable symptoms."
Dehydration,https://www.mayoclinic.org/diseases-conditions/dehydration/symptoms-causes/syc-20354086,"Thirst isn't always a good way to tell if the body needs water. Many people, mainly older adults, don't feel thirsty until they're dehydrated. That's why it's important to increase water intake during hot weather or while ill.; The symptoms of dehydration can differ by age."
Delayed ejaculation,https://www.mayoclinic.org/diseases-conditions/delayed-ejaculation/symptoms-causes/syc-20371358,"There's no set time that means a diagnosis of delayed ejaculation. Some people with delayed ejaculation need many minutes of sexual stimulation to have an orgasm and ejaculate. Others might not be able to ejaculate at all, called anejaculation.; In delayed ejaculation, the delay causes upset. Also delayed ejaculation might mean stopping sex due to tiredness, physical irritation, loss of erection or because the partner wants to stop.; Often, there's trouble reaching orgasm during sexual intercourse or other sexual activities with a partner. Some people can ejaculate only when masturbating. But others may not be able to ejaculate by masturbating.; Delayed ejaculation is divided into the following types based on symptoms:; Lifelong versus acquired. With lifelong delayed ejaculation, the problem is present from the time of sexual maturity. Acquired delayed ejaculation happens after a period of typical sexual functioning.; Generalized versus situational. Generalized delayed ejaculation isn't limited to certain sex partners or certain kinds of arousal. Situational delayed ejaculation happens only under certain conditions."
Delayed sleep phase,https://www.mayoclinic.org/diseases-conditions/delayed-sleep-phase/symptoms-causes/syc-20353340,"People with delayed sleep phase fall asleep and wake later than they want and later than usual sleep and wake times. Sleep and wake times are delayed at least two hours and may be delayed up to 3 to 6 hours. People with delayed sleep phase may regularly go to sleep at 3 a.m. and wake at 10 a.m., for example.; Symptoms are persistent. They last at least three months and often for years. Symptoms may include:; Not being able to fall asleep at a typical bedtime, known as insomnia.; Trouble waking up in the morning in time to go to work or school.; Extreme daytime drowsiness.; Trouble staying alert during the day."
Delirium,https://www.mayoclinic.org/diseases-conditions/delirium/symptoms-causes/syc-20371386,"Symptoms of delirium usually begin over a few hours or a few days. They typically occur with a medical problem. Symptoms often come and go during the day. There may be periods of no symptoms. Symptoms tend to be worse at night when it's dark and things look less familiar. They also tend to be worse in settings that aren't familiar, such as in a hospital.; Primary symptoms include the following."
Dementia,https://www.mayoclinic.org/diseases-conditions/dementia/symptoms-causes/syc-20352013,Dementia symptoms vary depending on the cause. Common symptoms include:
Dengue fever,https://www.mayoclinic.org/diseases-conditions/dengue-fever/symptoms-causes/syc-20353078,"Many people experience no signs or symptoms of a dengue infection.; When symptoms do occur, they may be mistaken for other illnesses — such as the flu — and usually begin four to 10 days after you are bitten by an infected mosquito.; Dengue fever causes a high fever — 104 F (40 C) — and any of the following signs and symptoms:; Headache; Muscle, bone or joint pain; Nausea; Vomiting; Pain behind the eyes; Swollen glands; Rash; Most people recover within a week or so. In some cases, symptoms worsen and can become life-threatening. This is called severe dengue, dengue hemorrhagic fever or dengue shock syndrome.; Severe dengue happens when your blood vessels become damaged and leaky. And the number of clot-forming cells (platelets) in your bloodstream drops. This can lead to shock, internal bleeding, organ failure and even death.; Warning signs of severe dengue fever — which is a life-threatening emergency — can develop quickly. The warning signs usually begin the first day or two after your fever goes away, and may include:; Severe stomach pain; Persistent vomiting; Bleeding from your gums or nose; Blood in your urine, stools or vomit; Bleeding under the skin, which might look like bruising; Difficult or rapid breathing; Fatigue; Irritability or restlessness"
Depersonalization-derealization disorder,https://www.mayoclinic.org/diseases-conditions/depersonalization-derealization-disorder/symptoms-causes/syc-20352911,"Short experiences of depersonalization or derealization are fairly common. But lasting and returning bouts of these symptoms can cause problems at work or school, or in other important areas of your life. During these bouts, you know that your sense of not being connected to your body or your surroundings are only feelings and not reality.; The experience and feelings of the condition can be hard to describe. Worrying about ""going crazy"" can cause you to become focused on checking that you exist and finding out what's real.; Symptoms usually begin in the middle or late teenage years, or in early adulthood. Depersonalization-derealization disorder is rare in children and older adults."
Depression (major depressive disorder),https://www.mayoclinic.org/diseases-conditions/depression/symptoms-causes/syc-20356007,"Although depression may occur only once during your life, people typically have multiple episodes. During these episodes, symptoms occur most of the day, nearly every day and may include:; Feelings of sadness, tearfulness, emptiness or hopelessness; Angry outbursts, irritability or frustration, even over small matters; Loss of interest or pleasure in most or all normal activities, such as sex, hobbies or sports; Sleep disturbances, including insomnia or sleeping too much; Tiredness and lack of energy, so even small tasks take extra effort; Reduced appetite and weight loss or increased cravings for food and weight gain; Anxiety, agitation or restlessness; Slowed thinking, speaking or body movements; Feelings of worthlessness or guilt, fixating on past failures or self-blame; Trouble thinking, concentrating, making decisions and remembering things; Frequent or recurrent thoughts of death, suicidal thoughts, suicide attempts or suicide; Unexplained physical problems, such as back pain or headaches; For many people with depression, symptoms usually are severe enough to cause noticeable problems in day-to-day activities, such as work, school, social activities or relationships with others. Some people may feel generally miserable or unhappy without really knowing why."
Dermatitis,https://www.mayoclinic.org/diseases-conditions/dermatitis-eczema/symptoms-causes/syc-20352380,
Dermatofibrosarcoma protuberans,https://www.mayoclinic.org/diseases-conditions/dermatofibrosarcoma-protuberans/symptoms-causes/syc-20576872,"Symptoms of dermatofibrosarcoma protuberans include:; A lump or lumps on the skin that look like pimples, scars or birthmarks.; A lump or lumps on the skin that may feel hard to the touch or rubberlike.; A patch of skin that feels firm to the touch.; The lumps typically appear on the arms, legs or trunk. They rarely form on the head or neck."
Dermatographia (Dermatographism),https://www.mayoclinic.org/diseases-conditions/dermatographia/symptoms-causes/syc-20371411,"Symptoms of dermatographia may include:; Raised, inflamed lines where you scratched.; Welts from friction.; Swelling.; Itching.; The symptoms may occur within a few minutes of the skin being rubbed or scratched. They tend to go away within 30 minutes. Rarely, the skin symptoms develop more slowly and lasts several hours to days. The condition itself can last for months or years."
Dermatomyositis,https://www.mayoclinic.org/diseases-conditions/dermatomyositis/symptoms-causes/syc-20353188,"The signs and symptoms of dermatomyositis can appear suddenly or develop gradually over time. The most common signs and symptoms include:; Skin changes. A violet-colored or dusky red rash develops, most commonly on your face and eyelids and on your knuckles, elbows, knees, chest and back. The rash, which can be itchy and painful, is often the first sign of dermatomyositis.; Muscle weakness. Progressive muscle weakness involves the muscles closest to the trunk, such as those in your hips, thighs, shoulders, upper arms and neck. The weakness affects both the left and right sides of your body, and tends to gradually worsen."
Desmoid tumors,https://www.mayoclinic.org/diseases-conditions/desmoid-tumors/symptoms-causes/syc-20355083,"Desmoid tumor symptoms differ based on where the tumors occur. Desmoid tumors most often happen in the abdomen, arms and legs. But they can form anywhere in the body.; In general, signs and symptoms include:; A mass or area of swelling; Pain; Loss of function in the affected area; Cramping and nausea, when desmoid tumors occur in the abdomen"
Desmoplastic small round cell tumors,https://www.mayoclinic.org/diseases-conditions/dsrct/symptoms-causes/syc-20355405,Desmoplastic small round cell tumor symptoms vary depending on where the cancer begins. Most often it begins in the abdomen.; Signs and symptoms of desmoplastic small round cell tumors in the abdomen include:; Swelling of the abdomen; Abdominal pain; Constipation; Difficulty urinating
Deviated septum,https://www.mayoclinic.org/diseases-conditions/deviated-septum/symptoms-causes/syc-20351710,Most deviated septums have no symptoms. You might not know you have a deviated septum. But sometimes a deviated septum can cause the following:; Blockage in one or both nostrils. This blockage can make it hard to breathe. This might be worse during colds or allergies that can cause nasal passages to swell and narrow.; Nosebleeds. The surface of the nasal septum might become dry. This can raise the risk of nosebleeds.; Noisy breathing during sleep. A deviated septum or swelling of the tissues in the nose can be one of many reasons for noisy breathing during sleep.; Needing to sleep only on one side. Some people sleep on a certain side to ease breathing through the nose at night if one nasal passage is narrowed.
Diabetes,https://www.mayoclinic.org/diseases-conditions/diabetes/symptoms-causes/syc-20371444,"Diabetes symptoms depend on how high your blood sugar is. Some people, especially if they have prediabetes , gestational diabetes or type 2 diabetes , may not have symptoms. In type 1 diabetes , symptoms tend to come on quickly and be more severe.; Some of the symptoms of type 1 diabetes and type 2 diabetes are:; Feeling more thirsty than usual.; Urinating often.; Losing weight without trying.; Presence of ketones in the urine. Ketones are a byproduct of the breakdown of muscle and fat that happens when there's not enough available insulin.; Feeling tired and weak.; Feeling irritable or having other mood changes.; Having blurry vision.; Having slow-healing sores.; Getting a lot of infections, such as gum, skin and vaginal infections.; Type 1 diabetes can start at any age. But it often starts during childhood or teen years. Type 2 diabetes, the more common type, can develop at any age. Type 2 diabetes is more common in people older than 40. But type 2 diabetes in children is increasing."
Diabetes insipidus,https://www.mayoclinic.org/diseases-conditions/diabetes-insipidus/symptoms-causes/syc-20351269,"Symptoms of diabetes insipidus in adults include:; Being very thirsty, often with a preference for cold water.; Making large amounts of pale urine.; Getting up to urinate and drink water often during the night.; Adults typically urinate an average of 1 to 3 quarts (about 1 to 3 liters) a day. People who have diabetes insipidus and who drink a lot of fluids may make as much as 20 quarts (about 19 liters) of urine a day.; A baby or young child who has diabetes insipidus may have these symptoms:; Large amounts of pale urine that result in heavy, wet diapers.; Bed-wetting.; Being very thirsty, with a preference for drinking water and cold liquids.; Weight loss.; Poor growth.; Vomiting.; Irritability.; Fever.; Constipation.; Headache.; Problems sleeping.; Vision problems."
Diabetic coma,https://www.mayoclinic.org/diseases-conditions/diabetic-coma/symptoms-causes/syc-20371475,Symptoms of high blood sugar or low blood sugar usually develop before a diabetic coma.
Diabetic hypoglycemia,https://www.mayoclinic.org/diseases-conditions/diabetic-hypoglycemia/symptoms-causes/syc-20371525,Diabetic hypoglycemia can cause a number of symptoms. The symptoms depend on factors such as how long you've been getting low blood sugar and how serious it is. Even the time of day can play a role.
Diabetic ketoacidosis,https://www.mayoclinic.org/diseases-conditions/diabetic-ketoacidosis/symptoms-causes/syc-20371551,"Diabetic ketoacidosis symptoms often come on quickly, sometimes within 24 hours. For some, these symptoms may be the first sign of diabetes. Symptoms might include:; Being very thirsty.; Urinating often.; Feeling a need to throw up and throwing up.; Having belly pain.; Being weak or tired.; Being short of breath.; Having fruity-scented breath.; Being confused.; More-certain signs of diabetic ketoacidosis show up in home blood and urine test kits. They include:; High blood sugar levels.; High ketone levels in urine."
Diabetic nephropathy (kidney disease),https://www.mayoclinic.org/diseases-conditions/diabetic-nephropathy/symptoms-causes/syc-20354556,"In the early stages of diabetic nephropathy, there might not be symptoms. In later stages, symptoms may include:; High blood pressure that gets harder to control.; Swelling of feet, ankles, hands or eyes.; Foamy urine.; Confusion or difficulty thinking.; Shortness of breath.; Loss of appetite.; Nausea and vomiting.; Itching.; Tiredness and weakness."
Diabetic neuropathy,https://www.mayoclinic.org/diseases-conditions/diabetic-neuropathy/symptoms-causes/syc-20371580,"There are four main types of diabetic neuropathy. You can have one type or more than one type of neuropathy.; The symptoms depend on the type of diabetic neuropathy you have and which nerves are affected. Usually, symptoms appear slowly over time. You may not notice anything is wrong until a lot of nerve damage has happened."
Diabetic retinopathy,https://www.mayoclinic.org/diseases-conditions/diabetic-retinopathy/symptoms-causes/syc-20371611,"Some people have no symptoms in the early stages of diabetic retinopathy. As the condition gets worse, people may develop:; Spots or dark strings floating in their sight, called floaters.; Blurred vision.; Changes in vision.; Dark or empty areas in their vision.; Vision loss."
