disease_name,url,symptoms
Abdominal aortic aneurysm,https://www.mayoclinic.org/diseases-conditions/abdominal-aortic-aneurysm/symptoms-causes/syc-20350688,"Abdominal aortic aneurysms often grow slowly. You might not notice any symptoms. This makes them hard to find. Many start small and stay small. Others get bigger over time, sometimes quickly. Some aneurysms never rupture.; If you have an abdominal aortic aneurysm that's getting bigger, symptoms might include:; Deep, constant pain in the belly area or side of the belly.; Back pain.; A throbbing or pulsing feeling near the belly button."
Absence seizure,https://www.mayoclinic.org/diseases-conditions/petit-mal-seizure/symptoms-causes/syc-20359683,"A simple absence seizure causes a vacant stare, which may be mistaken for a brief lapse in attention. The seizure lasts about 10 seconds, though it may last as long as 30 seconds. There's no confusion, headache or drowsiness after the seizure.; Symptoms of absence seizures include:; A sudden stop in activity without falling.; Lip smacking.; Eyelid flutters.; Chewing motions.; Finger rubbing.; Small movements of both hands.; Afterward, there's usually no memory of the incident. But if the seizure is longer, the person may be aware of missed time. Some people have many episodes daily. When it happens, it can interfere with school or daily activities.; A child may have absence seizures for some time before an adult notices them. This is because the seizures are so brief. A decline in a child's learning ability may be the first sign of the seizure disorder. Teachers may say the child has trouble paying attention or that a child is often daydreaming."
Acanthosis nigricans,https://www.mayoclinic.org/diseases-conditions/acanthosis-nigricans/symptoms-causes/syc-20368983,"The main sign of acanthosis nigricans is dark, thick, velvety skin in body folds and creases. It often appears in the armpits, groin and back of the neck. It develops slowly. The affected skin might be itchy, have an odor and develop skin tags."
Achalasia,https://www.mayoclinic.org/diseases-conditions/achalasia/symptoms-causes/syc-20352850,"Achalasia symptoms generally appear gradually and get worse over time. Symptoms may include:; Difficulty swallowing, called dysphagia, which may feel like food or drink is stuck in the throat.; Swallowed food or saliva flowing back into the throat.; Heartburn.; Belching.; Chest pain that comes and goes.; Coughing at night.; Pneumonia from getting food in the lungs.; Weight loss.; Vomiting.; There is a problem with information submitted for this request. Review/update the information highlighted below and resubmit the form."
Achilles tendinitis,https://www.mayoclinic.org/diseases-conditions/achilles-tendinitis/symptoms-causes/syc-20369020,"Achilles tendinitis pain most often begins as a mild ache in the back of the leg or above the heel after running or other sports activity. More-severe burning or aching pain might occur after running a long time, stair climbing or sprinting. Over time, there might be pain even at rest.; Achilles tendinitis can make it hard to use the affected foot. The area also might be tender or stiff, especially in the morning. The soreness usually gets better with mild activity."
Achilles tendon rupture,https://www.mayoclinic.org/diseases-conditions/achilles-tendon-rupture/symptoms-causes/syc-20353234,"Although it's possible to have no signs or symptoms with an Achilles tendon rupture, most people have:; The feeling of having been kicked in the calf; Pain, possibly severe, and swelling near the heel; An inability to bend the foot downward or ""push off"" the injured leg when walking; An inability to stand on the toes on the injured leg; A popping or snapping sound when the injury occurs"
ACL injury,https://www.mayoclinic.org/diseases-conditions/acl-injury/symptoms-causes/syc-20350738,"Signs and symptoms of an ACL injury usually include:; A loud pop or a ""popping"" sensation in the knee; Severe pain and inability to continue activity; Rapid swelling; Loss of range of motion; A feeling of instability or ""giving way"" with weight bearing"
Acne,https://www.mayoclinic.org/diseases-conditions/acne/symptoms-causes/syc-20368047,
Acoustic neuroma,https://www.mayoclinic.org/diseases-conditions/acoustic-neuroma/symptoms-causes/syc-20356127,"Symptoms of an acoustic neuroma often are easy to miss and may take years to develop. Symptoms may occur because of the tumor's effects on the hearing and balance nerves. The tumor also can put pressure on the facial nerve that directs facial muscles and the trigeminal nerve that affects feeling in the face. Blood vessels or other brain structures also can be affected by an acoustic neuroma.; As the tumor grows, it may be more likely to cause more noticeable or worse symptoms.; Common signs and symptoms of an acoustic neuroma include:; Hearing loss, usually gradually over months to years. In rare cases, hearing loss can be sudden. Hearing loss usually occurs on one side or is worse on one side.; Ringing in the affected ear, known as tinnitus.; Loss of balance or not feeling steady.; Dizziness.; Facial numbness and, very rarely, weakness or loss of muscle movement.; Rarely, an acoustic neuroma may grow large enough to compress the brainstem and become life-threatening."
Acromegaly,https://www.mayoclinic.org/diseases-conditions/acromegaly/symptoms-causes/syc-20351222,"Acromegaly symptoms can change the way some body parts look. Changes can include:; Thick ears and lips.; A broad nose.; Enlarged hands and feet.; A jutting brow or jaw.; Gaps between teeth.; An enlarged tongue.; An expanded rib cage that may cause the chest to have a round shape.; Skin changes can include:; Acne.; Harmless skin growths called skin tags.; Coarse, oily and thickened skin.; Swelling in the tissue under the skin.; Most often, people with acromegaly don't have every possible body change. And because the changes come on slowly, they may take years to notice. But over time, rings may no longer fit fingers like they used to. Or shoe size may get bigger. Sometimes, people notice the changes only by comparing old photos with newer ones.; Other acromegaly symptoms can include:; Vision troubles, including loss of side vision.; More sweating and body odor than is typical.; Extreme tiredness.; Headaches.; Joint pain.; Deeper voice."
Actinic keratosis,https://www.mayoclinic.org/diseases-conditions/actinic-keratosis/symptoms-causes/syc-20354969,"Actinic keratoses vary in appearance. Symptoms include:; Rough, dry or scaly patch of skin, usually less than 1 inch (2.5 centimeters) in diameter; Flat to slightly raised patch or bump on the top layer of skin; In some cases, a hard, wartlike surface; Color variations, including pink, red or brown; Itching, burning, bleeding or crusting; New patches or bumps on sun-exposed areas of the head, neck, hands and forearms"
Acute coronary syndrome,https://www.mayoclinic.org/diseases-conditions/acute-coronary-syndrome/symptoms-causes/syc-20352136,"The symptoms of acute coronary syndrome usually start suddenly. They include:; Chest pain or discomfort. It may feel like aching, pressure, tightness or burning. Chest pain also is called angina.; Pain that starts in the chest and spreads to other parts of the body. These areas include the shoulders, arms, upper belly area, back, neck or jaw.; Nausea or vomiting.; Pain or burning in the upper belly, called indigestion.; Shortness of breath, also called dyspnea.; Sudden, heavy sweating.; Racing heartbeat.; Feeling lightheaded or dizzy.; Fainting.; Unusual fatigue.; Chest pain or discomfort is the most common symptom of acute coronary syndrome. But symptoms may vary a lot depending on age, sex assigned at birth and other medical conditions. Women, older adults and people with diabetes are more likely to have symptoms without chest pain or discomfort."
Acute flaccid myelitis (AFM),https://www.mayoclinic.org/diseases-conditions/acute-flaccid-myelitis/symptoms-causes/syc-20493046,"The most common signs and symptoms of acute flaccid myelitis include:; Sudden arm or leg weakness; Sudden loss of muscle tone; Sudden loss of reflexes; Other possible signs and symptoms include:; Difficulty moving the eyes or drooping eyelids; Facial droop or weakness; Difficulty with swallowing or slurred speech; Pain in the arms, legs, neck or back; Uncommon symptoms might include:; Numbness or tingling; Inability to pass urine; Severe symptoms involve respiratory failure, due to the muscles involved in breathing becoming weak. It's also possible to experience life-threatening body temperature changes and blood pressure instability."
Acute kidney injury,https://www.mayoclinic.org/diseases-conditions/kidney-failure/symptoms-causes/syc-20369048,"Symptoms of acute kidney injury may include:; Less urine output.; Fluid buildup, which can cause shortness of breath and swelling in the legs, ankles or feet.; Tiredness.; Confusion or fogginess.; Nausea.; Pain in the belly or in the side below the rib cage.; Weakness.; Irregular heartbeat.; Itching.; Loss of appetite.; Chest pain or pressure.; Seizures or coma in severe cases.; Sometimes acute kidney injury causes no symptoms. Then it may be found through lab tests done for something else."
Acute liver failure,https://www.mayoclinic.org/diseases-conditions/acute-liver-failure/symptoms-causes/syc-20352863,"Symptoms of acute liver failure may include:; Yellowing of the skin and eyeballs, called jaundice.; Pain in the upper right belly area, called the abdomen.; A swollen belly, known as ascites.; Nausea and vomiting.; A general sense of feeling unwell, known as malaise.; Disorientation or confusion.; Sleepiness.; Breath with a musty or sweet odor.; Tremors."
Acute lymphocytic leukemia,https://www.mayoclinic.org/diseases-conditions/acute-lymphocytic-leukemia/symptoms-causes/syc-20369077,"Signs and symptoms of acute lymphocytic leukemia may include:; Bleeding from the gums; Bone pain; Fever; Frequent infections; Frequent or severe nosebleeds; Lumps caused by swollen lymph nodes in and around the neck, armpits, abdomen or groin; Pale skin; Shortness of breath; Weakness, fatigue or a general decrease in energy"
Acute myelogenous leukemia,https://www.mayoclinic.org/diseases-conditions/acute-myelogenous-leukemia/symptoms-causes/syc-20369109,"Symptoms of acute myelogenous leukemia may include:; Fever.; Pain. Common places for pain include the bones, back and stomach.; Feeling very tired.; Paleness or change in skin color.; Frequent infections.; Easy bruising.; Bleeding with no clear cause, such as in the nose or gums.; Shortness of breath."
Acute sinusitis,https://www.mayoclinic.org/diseases-conditions/acute-sinusitis/symptoms-causes/syc-20351671,"Acute sinusitis symptoms often include:; Thick, yellow or greenish mucus from the nose, known as a runny nose, or down the back of the throat, known as postnasal drip.; Blocked or stuffy nose, known as congestion. This makes it hard to breathe through the nose.; Pain, tenderness, swelling and pressure around the eyes, cheeks, nose or forehead that gets worse when bending over.; Other signs and symptoms include:; Ear pressure.; Headache.; Aching in the teeth.; Changed sense of smell.; Cough.; Bad breath.; Tiredness.; Fever."
Addison's disease,https://www.mayoclinic.org/diseases-conditions/addisons-disease/symptoms-causes/syc-20350293,"Addison's disease symptoms usually happen slowly, often over months. The disease may happen so slowly that people who have it might ignore the symptoms at first. Physical stress such as an illness or injury can make symptoms get worse fast.; Early symptoms of Addison's disease can affect you in various ways. Some early symptoms can cause discomfort or loss of energy, including:; Extreme tiredness, also called fatigue.; Dizziness or fainting when standing after sitting or lying down. This is due to a type of low blood pressure called postural hypotension.; Sweating due to low blood sugar, also called hypoglycemia.; Upset stomach, diarrhea or vomiting.; Pain in the stomach area, also called the abdomen.; Muscle cramps, weakness, widespread pain or joint pain.; Other early symptoms can cause changes in how you look, such as:; Body hair loss.; Areas of darkened skin, especially on scars and moles. These changes may be harder to see on Black or brown skin.; Weight loss due to less hunger.; Early Addison's disease symptoms also can affect emotions, mental health and desires. These symptoms include:; Depression.; Irritable mood.; Lower sex drive in women.; Salt craving."
Adenomyosis,https://www.mayoclinic.org/diseases-conditions/adenomyosis/symptoms-causes/syc-20369138,"Sometimes, adenomyosis causes no signs or symptoms or only mild discomfort. However, adenomyosis can cause:; Heavy or prolonged menstrual bleeding; Severe cramping or sharp, knifelike pelvic pain during menstruation (dysmenorrhea); Chronic pelvic pain; Painful intercourse (dyspareunia); Your uterus might get bigger. Although you might not know if your uterus is bigger, you may notice tenderness or pressure in your lower abdomen."
Adjustment disorders,https://www.mayoclinic.org/diseases-conditions/adjustment-disorders/symptoms-causes/syc-20355224,"Symptoms depend on the type of adjustment disorder. These symptoms can vary from person to person. You experience more stress than would generally be expected in response to a trying event, and this stress causes a lot of problems in your life.; Adjustment disorders affect how you feel and think about yourself and the world. They also may affect your actions or behavior.; Some examples include:; Feeling sad, hopeless or not enjoying things you used to enjoy.; Crying often.; Worrying, or feeling anxious, nervous, jittery or stressed out.; Feeling irritable or like you can't handle anything and don't know where to start.; Having trouble sleeping.; Not eating enough.; Having difficulty concentrating.; Having difficulty with daily activities.; Withdrawing from family and friends who support you socially.; Not doing important things, such as going to work or paying bills.; Thinking about suicide or acting on those thoughts.; Symptoms of an adjustment disorder start within three months of a stressful event. These symptoms last no longer than six months after the end of the stressful event. But constant or lasting adjustment disorders can continue for more than six months. This is especially true if the stressful event is ongoing, such as being unemployed."
Adnexal tumors and masses,https://www.mayoclinic.org/diseases-conditions/adnexal-tumors/symptoms-causes/syc-20355053,"Many adnexal tumors and masses don't cause symptoms. They're often found during a medical exam that's done for another reason.; When adnexal tumors and masses cause symptoms, the symptoms may include:; Pain, including pain in the pelvis or belly, painful period cramps that are worse than usual, and painful sex.; A feeling of fullness or pressure in the pelvis or belly, or feeling full quickly when eating.; Nausea and vomiting.; Constipation or bloating.; Urinating a lot or having trouble urinating.; Bleeding from the vagina that is out of the ordinary.; Fever."
Adrenal cancer,https://www.mayoclinic.org/diseases-conditions/adrenal-cancer/symptoms-causes/syc-20351026,"Signs and symptoms of adrenal cancer may include:; Back pain.; Belly pain.; Losing weight without trying.; Loss of appetite.; Many people who have adrenal cancer develop hormone changes in the body. These changes can happen if the cancer cells make extra hormones. Most often, the adrenal cancer makes the hormone cortisol. This can cause symptoms of Cushing syndrome, including:; Weight gain.; Muscle weakness.; Pink or purple stretch marks on the skin.; Bruises that happen even with a small injury.; High blood pressure.; High blood sugar or diabetes.; Less often, an adrenal cancer might make the sex hormones estrogen and testosterone. In females, changes in the sex hormones can cause extra facial hair, hair loss on the head and periods that aren't regular. In males, these hormone changes may cause the testicles to shrink and breast tissue to get bigger.; Rarely, adrenal cancer may make the hormone aldosterone. That can cause high blood pressure and low levels of potassium in the blood."
Adrenoleukodystrophy,https://www.mayoclinic.org/diseases-conditions/adrenoleukodystrophy/symptoms-causes/syc-20369157,
Adult attention-deficit/hyperactivity disorder (ADHD),https://www.mayoclinic.org/diseases-conditions/adult-adhd/symptoms-causes/syc-20350878,"Some people with ADHD have fewer symptoms as they age, but some adults continue to have major symptoms that interfere with daily functioning. In adults, the main features of ADHD may include difficulty paying attention, impulsiveness and restlessness. Symptoms can range from mild to severe.; Many adults with ADHD aren't aware they have it — they just know that everyday tasks can be a challenge. Adults with ADHD may find it difficult to focus and prioritize, leading to missed deadlines and forgotten meetings or social plans. The inability to control impulses can range from impatience waiting in line or driving in traffic to mood swings and outbursts of anger.; Adult ADHD symptoms may include:; Impulsiveness; Disorganization and problems prioritizing; Poor time management skills; Problems focusing on a task; Trouble multitasking; Excessive activity or restlessness; Poor planning; Low frustration tolerance; Frequent mood swings; Problems following through and completing tasks; Hot temper; Trouble coping with stress"
Adult Still disease,https://www.mayoclinic.org/diseases-conditions/adult-stills-disease/symptoms-causes/syc-20351907,"Most people with adult Still disease have a combination of the following symptoms:; Fever. Fever may rise to at least 102 degrees Fahrenheit (38.9 degrees Celsius). The fever may spike once or twice a day for a week or longer.; Rash. A rash might come and go with the fever. The rash usually appears on the trunk, arms or legs.; Sore throat. This is one of the first symptoms of adult Still disease. The lymph nodes in the neck might be swollen and tender.; Achy and swollen joints. Joints — especially in the knees and wrists— might be stiff, painful and inflamed. Ankles, elbows, hands and shoulders also might ache. The joint discomfort usually lasts at least two weeks.; Muscle pain. Muscular pain usually comes and goes with the fever. The pain can be severe enough to disrupt daily activities.; Symptoms of this disorder can differ from person to person. They can mimic those of other conditions, including lupus and a type of cancer called lymphoma."
Age spots (liver spots),https://www.mayoclinic.org/diseases-conditions/age-spots/symptoms-causes/syc-20355859,"Age spots may affect people of all skin types, but they're more common in adults with skin that sunburns easily. Unlike freckles, which are common in children and fade with no sun exposure, age spots don't fade."
Agoraphobia,https://www.mayoclinic.org/diseases-conditions/agoraphobia/symptoms-causes/syc-20355987,"Typical agoraphobia symptoms include fear of:; Leaving home alone.; Crowds or waiting in line.; Enclosed spaces, such as movie theaters, elevators or small stores.; Open spaces, such as parking lots, bridges or malls.; Using public transportation, such as a bus, plane or train.; These situations cause anxiety because you fear you won't be able to escape or find help if you start to feel panicked. Or you may fear having other disabling or embarrassing symptoms, such as dizziness, fainting, falling or diarrhea.; In addition:; Your fear or anxiety is out of proportion to the actual danger of the situation.; You avoid the situation, you need a companion to go with you, or you endure the situation but are extremely upset.; You have major distress or problems with social situations, work or other areas in your life because of the fear, anxiety or avoidance.; Your fear and avoidance usually lasts six months or longer."
Airplane ear,https://www.mayoclinic.org/diseases-conditions/airplane-ear/symptoms-causes/syc-20351701,"Airplane ear can happen in one or both ears. Common symptoms of airplane ear include:; Discomfort in the ear.; Feeling of fullness or stuffiness in the ear.; Muffled hearing or some hearing loss.; Symptoms of severe airplane ear might include:; Severe pain.; Increased pressure in the ear.; Worse hearing loss.; Ringing in the ear, called tinnitus.; Feeling of spinning, called vertigo.; Bleeding from the ear."
Albinism,https://www.mayoclinic.org/diseases-conditions/albinism/symptoms-causes/syc-20369184,"Symptoms of albinism involve skin, hair and eye color, as well as vision."
Alcohol intolerance,https://www.mayoclinic.org/diseases-conditions/alcohol-intolerance/symptoms-causes/syc-20369211,"Signs and symptoms of alcohol intolerance — or of a reaction to ingredients in an alcoholic beverage — can include:; Facial redness (flushing); Red, itchy skin bumps (hives); Worsening of pre-existing asthma; Runny or stuffy nose; Low blood pressure; Nausea and vomiting; Diarrhea"
Alcohol poisoning,https://www.mayoclinic.org/diseases-conditions/alcohol-poisoning/symptoms-causes/syc-20354386,"Alcohol poisoning symptoms include:; Confusion.; Vomiting.; Seizures.; Slow breathing, which is fewer than eight breaths a minute.; Breathing that's not regular. This is when there is a gap of more than 10 seconds between breaths.; Skin that looks blue, gray or pale.; Low body temperature, also known as hypothermia.; Trouble staying conscious or awake."
Alcohol use disorder,https://www.mayoclinic.org/diseases-conditions/alcohol-use-disorder/symptoms-causes/syc-20369243,"Alcohol use disorder can be mild, moderate or severe, based on the number of symptoms you experience. Signs and symptoms may include:; Being unable to limit the amount of alcohol you drink; Wanting to cut down on how much you drink or making unsuccessful attempts to do so; Spending a lot of time drinking, getting alcohol or recovering from alcohol use; Feeling a strong craving or urge to drink alcohol; Failing to fulfill major obligations at work, school or home due to repeated alcohol use; Continuing to drink alcohol even though you know it's causing physical, social, work or relationship problems; Giving up or reducing social and work activities and hobbies to use alcohol; Using alcohol in situations where it's not safe, such as when driving or swimming; Developing a tolerance to alcohol so you need more to feel its effect or you have a reduced effect from the same amount; Experiencing withdrawal symptoms — such as nausea, sweating and shaking — when you don't drink, or drinking to avoid these symptoms; Alcohol use disorder can include periods of being drunk (alcohol intoxication) and symptoms of withdrawal.; Alcohol intoxication results as the amount of alcohol in your bloodstream increases. The higher the blood alcohol concentration is, the more likely you are to have bad effects. Alcohol intoxication causes behavior problems and mental changes. These may include inappropriate behavior, unstable moods, poor judgment, slurred speech, problems with attention or memory, and poor coordination. You can also have periods called ""blackouts,"" where you don't remember events. Very high blood alcohol levels can lead to coma, permanent brain damage or even death.; Alcohol withdrawal can occur when alcohol use has been heavy and prolonged and is then stopped or greatly reduced. It can occur within several hours to 4 to 5 days later. Signs and symptoms include sweating, rapid heartbeat, hand tremors, problems sleeping, nausea and vomiting, hallucinations, restlessness and agitation, anxiety, and occasionally seizures. Symptoms can be severe enough to impair your ability to function at work or in social situations."
Alcoholic hepatitis,https://www.mayoclinic.org/diseases-conditions/alcoholic-hepatitis/symptoms-causes/syc-20351388,"The most common sign of alcoholic hepatitis is yellowing of the skin and whites of the eyes, called jaundice. The yellowing of the skin might be harder to see on Black and brown people.; Other symptoms include:; Loss of appetite.; Nausea and vomiting.; Belly tenderness.; Fever, often low grade.; Tiredness and weakness.; People with alcoholic hepatitis tend to be malnourished. Drinking large amounts of alcohol keeps people from being hungry. And heavy drinkers get most of their calories from alcohol.; Other symptoms that happen with severe alcoholic hepatitis include:; Fluid buildup in the belly, called ascites.; Being confused and acting oddly due to a buildup of toxins. The healthy liver breaks these toxins down and gets rid of them.; Kidney and liver failure."
