disease_name,url,symptoms
Pityriasis rosea,https://www.mayoclinic.org/diseases-conditions/pityriasis-rosea/symptoms-causes/syc-20376405,"Pityriasis rosea typically begins with an oval, slightly raised, scaly patch — called the herald patch — on the face, back, chest or abdomen. Before the herald patch appears, some people have headache, fatigue, fever or sore throat.; A few days to a few weeks after the herald patch appears, you may notice smaller bumps or scaly spots across your face, back, chest or abdomen that look like a pine-tree pattern. The rash can cause itching."
Placenta accreta,https://www.mayoclinic.org/diseases-conditions/placenta-accreta/symptoms-causes/syc-20376431,"Placenta accreta often causes no signs or symptoms during pregnancy — although vaginal bleeding during the third trimester might occur.; Occasionally, placenta accreta is detected during a routine ultrasound."
Placenta previa,https://www.mayoclinic.org/diseases-conditions/placenta-previa/symptoms-causes/syc-20352768,"The main sign of placenta previa is bright red vaginal bleeding, usually without pain, after 20 weeks of pregnancy. Sometimes, spotting happens before an event with more blood loss.; The bleeding may occur with prelabor contractions of the uterus that cause pain. The bleeding may also be triggered by sex or during a medical exam. For some women, bleeding may not occur until labor. Often there is no clear event that leads to bleeding."
Placental abruption,https://www.mayoclinic.org/diseases-conditions/placental-abruption/symptoms-causes/syc-20376458,"Placental abruption is most likely to occur in the last trimester of pregnancy, especially in the last few weeks before birth. Signs and symptoms of placental abruption include:; Vaginal bleeding, although there might not be any; Abdominal pain; Back pain; Uterine tenderness or rigidity; Uterine contractions, often coming one right after another; Abdominal pain and back pain often begin suddenly. The amount of vaginal bleeding can vary greatly, and doesn't necessarily indicate how much of the placenta has separated from the uterus. It's possible for the blood to become trapped inside the uterus, so even with a severe placental abruption, there might be no visible bleeding.; In some cases, placental abruption develops slowly (chronic abruption), which can cause light, intermittent vaginal bleeding. Your baby might not grow as quickly as expected, and you might have low amniotic fluid or other complications."
Plague,https://www.mayoclinic.org/diseases-conditions/plague/symptoms-causes/syc-20351291,There are three types of plague. The symptoms vary for each type.
Plantar fasciitis,https://www.mayoclinic.org/diseases-conditions/plantar-fasciitis/symptoms-causes/syc-20354846,"Plantar fasciitis typically causes a stabbing pain in the bottom of your foot near the heel. The pain is usually the worst with the first few steps after awakening, although it also can be triggered by long periods of standing or when you get up from sitting.; There is a problem with information submitted for this request. Review/update the information highlighted below and resubmit the form."
Plantar warts,https://www.mayoclinic.org/diseases-conditions/plantar-warts/symptoms-causes/syc-20352691,"Plantar wart signs and symptoms include:; A small, rough growth on the bottom of your foot, usually at the base of the toes or on the ball or heel; On brown and Black skin, the growth may be lighter than unaffected skin; Hard, thickened skin (callus) over a spot on the skin, where a wart has grown inward; Black pinpoints, which are small clotted blood vessels commonly called wart seeds; A cluster of growths on the sole of the foot (mosaic warts); A growth that interrupts the normal lines and ridges in the skin of your foot; Pain or tenderness when walking or standing"
Pleurisy,https://www.mayoclinic.org/diseases-conditions/pleurisy/symptoms-causes/syc-20351863,"Signs and symptoms of pleurisy might include:; Chest pain that worsens when you breathe, cough or sneeze.; Shortness of breath — often from trying to limit breathing in and out.; Cough — only in some cases.; Fever — only in some cases.; Pain caused by pleurisy might worsen with movement of your upper body and can spread to your shoulders or back.; Pleurisy can occur along with pleural effusion, atelectasis or empyema:; Pleural effusion. In some cases of pleurisy, fluid builds up in the small space between the two layers of tissue. This is called pleural effusion. When there is a fair amount of fluid, pleuritic pain lessens or disappears because the two layers of pleura are no longer in contact and don't rub together.; Atelectasis. A large amount of fluid in the pleural space can create pressure. This can compress your lung to the point that it partially or completely collapses (atelectasis). This makes breathing difficult and might cause coughing.; Empyema. The extra fluid in the pleural space can also become infected, resulting in a buildup of pus. This is called an empyema. Fever often occurs along with an empyema."
Plexiform neurofibroma,https://www.mayoclinic.org/diseases-conditions/plexiform-neurofibroma/symptoms-causes/syc-20587495,"Plexiform neurofibromas can cause different symptoms based on where they grow, how big they are, and how they press on nearby nerves and tissues. Some people have no symptoms at first. Others may notice changes in how their bodies look, feel or move.; Common signs and symptoms of plexiform neurofibroma include:; Pain. Ongoing pain, which may be moderate to severe, is common in people with plexiform neurofibroma. Pain from plexiform neurofibroma can make it difficult to do daily activities and affect movement.; Swelling or soft lumps. Tumors can cause growths that can be seen or felt under the skin. These may grow over time and may be soft, spongy or thickened.; Changes in appearance. Tumors in visible areas such as the face or limbs can cause disfigurement, leading to emotional or social concerns.; Movement changes. Tumors pressing on nerves or muscles can make it harder to walk, grasp objects or perform everyday tasks.; Vision changes. Tumors near the eyes or the optic nerve can cause blurred vision, drooping eyelids or other changes in how the eyes look or work.; Numbness or tingling. These symptoms may occur when the tumor interferes with how a nerve works — either by pressing on it or growing into it.; Bladder or bowel changes. Plexiform neurofibromas near the pelvis or lower spine can affect the nerves that control the bladder and bowel. This can lead to symptoms such as urgency, frequent urination, leakage or trouble emptying, as well as constipation or stool leakage.; High blood pressure. Some tumors may affect nearby structures or organs in a way that leads to high blood pressure, especially if they press on blood vessels or involve the kidneys or adrenal glands.; Emotional changes. Children may feel anxious, sad or lonely due to their symptoms, appearance or ongoing pain."
Pneumonia,https://www.mayoclinic.org/diseases-conditions/pneumonia/symptoms-causes/syc-20354204,"The signs and symptoms of pneumonia vary from mild to severe, depending on factors such as the type of germ causing the infection, and your age and overall health. Mild signs and symptoms often are similar to those of a cold or flu, but they last longer.; Signs and symptoms of pneumonia may include:; Chest pain when you breathe or cough; Confusion or changes in mental awareness (in adults age 65 and older); Cough, which may produce phlegm; Fatigue; Fever, sweating and shaking chills; Lower than normal body temperature (in adults older than age 65 and people with weak immune systems); Nausea, vomiting or diarrhea; Shortness of breath; Newborns and infants may not show any sign of the infection. Or they may vomit, have a fever and cough, appear restless or tired and without energy, or have difficulty breathing and eating."
Pneumonitis,https://www.mayoclinic.org/diseases-conditions/pneumonitis/symptoms-causes/syc-20352623,"Symptoms of pneumonitis may develop quickly or slowly and can worsen over time. At times symptoms may suddenly get worse or better. Also, symptoms vary greatly among people with the condition and include:; Trouble breathing.; Dry cough that usually doesn't bring up any mucus.; Extreme tiredness.; Loss of appetite.; Fever.; Joint and muscle pain.; Headache.; Weight loss."
Pneumothorax,https://www.mayoclinic.org/diseases-conditions/pneumothorax/symptoms-causes/syc-20350367,The main symptoms of a pneumothorax are sudden chest pain and shortness of breath. Severity of symptoms may depend on how much of the lung is collapsed.
POEMS syndrome,https://www.mayoclinic.org/diseases-conditions/poems-syndrome/symptoms-causes/syc-20352678,"The symptoms of POEMS syndrome make up its name. Symptoms most often appear over weeks to months. They include the following:; Polyneuropathy. This may include numbness, tingling and weakness in the legs. In time, it might affect the hands. It also involves trouble breathing. Polyneuropathy must be present for a POEMS diagnosis.; Organomegaly. This is an enlarged spleen, liver or lymph nodes.; Endocrinopathy and edema. Atypical hormone levels can cause an underactive thyroid, also called hypothyroidism. The hormone levels also can cause diabetes, sexual issues, tiredness, and swelling in arms and legs.; Monoclonal protein. This is a protein that atypical plasma cells in bone marrow make. The monoclonal protein goes into the bloodstream. This must be present for the diagnosis of POEMS syndrome. Monoclonal protein often is linked with bones getting harder or thicker.; Skin changes. This may involve having more color than usual on the skin. There may be red spots, which may be harder to see on Black or brown skin. The skin might be thicker. There might be more hair on the face or the legs.; Not all the symptoms of POEMS syndrome are in the name. And not everyone with POEMS syndrome has all the symptoms in the name. But everyone with POEMS syndrome has polyneuropathy and monoclonal protein.; Other symptoms some people with POEMS syndrome have spell out PEST. PEST stands for:; Papilledema. This is swelling in the back of the eyes.; Extravascular volume overload. This might include ankle swelling, fluid between the lung and the ribs, or fluid in the belly.; Sclerotic bone lesions. X-rays can show these bone spots. They're most often not painful.; Thrombocytosis and erythrocytosis. These are higher levels of red cells and platelets in the bloodstream."
Poison ivy rash,https://www.mayoclinic.org/diseases-conditions/poison-ivy/symptoms-causes/syc-20376485,"Signs and symptoms of a poison ivy rash include:; Redness; Itching; Swelling; Blisters; Difficulty breathing, if you've inhaled the smoke from burning poison ivy; Poison ivy rash often appears in a straight line because of the way the plant brushes against your skin. But if you develop a rash after touching a piece of clothing or pet fur that has urushiol on it, the rash may be more spread out. You can also transfer the oil to other parts of your body with your fingers. The reaction usually develops 12 to 48 hours after exposure and lasts two to three weeks.; The severity of the rash depends on the amount of urushiol that gets on your skin."
Polio,https://www.mayoclinic.org/diseases-conditions/polio/symptoms-causes/syc-20376512,
Polycystic kidney disease,https://www.mayoclinic.org/diseases-conditions/polycystic-kidney-disease/symptoms-causes/syc-20352820,"Polycystic kidney disease symptoms can include:; High blood pressure.; Belly, side or back pain.; Blood in the urine.; A feeling of fullness in the belly.; Increased size of the belly from enlarged kidneys.; Headaches.; Kidney stones.; Kidney failure.; Urinary tract or kidney infections."
Polycystic ovary syndrome (PCOS),https://www.mayoclinic.org/diseases-conditions/pcos/symptoms-causes/syc-20353439,"Symptoms of PCOS often start around the time of the first menstrual period. Sometimes symptoms develop later after you have had periods for a while.; The symptoms of PCOS vary. A diagnosis of PCOS is made when you have at least two of these:; Irregular periods. Having few menstrual periods or having periods that aren't regular are common signs of PCOS . So is having periods that last for many days or longer than is typical for a period. For example, you might have fewer than nine periods a year. And those periods may occur more than 35 days apart. You may have trouble getting pregnant.; Too much androgen. High levels of the hormone androgen may result in excess facial and body hair. This is called hirsutism. Sometimes, severe acne and male-pattern baldness can happen, too.; Polycystic ovaries. Your ovaries might be bigger. Many follicles containing immature eggs may develop around the edge of the ovary. The ovaries might not work the way they should.; PCOS signs and symptoms are typically more severe in people with obesity."
Polycythemia vera,https://www.mayoclinic.org/diseases-conditions/polycythemia-vera/symptoms-causes/syc-20355850,"Many people with polycythemia vera don't notice symptoms. Some people get symptoms such as headache, dizziness, tiredness and blurred vision.; Clearer symptoms of polycythemia vera include:; Itchiness, mostly after a warm bath or shower.; Numbness, tingling, burning or weakness in the hands, feet, arms or legs.; A feeling of fullness soon after eating.; Bloating or pain in the left upper stomach area due to an enlarged spleen.; Unusual bleeding, such as a nosebleed or bleeding gums.; Painful swelling of one joint, often the big toe.; Shortness of breath and trouble breathing when lying down.; Bone pain."
Polyhydramnios,https://www.mayoclinic.org/diseases-conditions/polyhydramnios/symptoms-causes/syc-20368493,"Polyhydramnios symptoms may be linked with the buildup of amniotic fluid creating pressure within the uterus and on nearby organs. Mild polyhydramnios often causes few or no symptoms. But serious forms of the condition may cause:; Shortness of breath or not being able to breathe.; Swelling in the ankles or feet.; Pain in the stomach area.; Feelings of tightness in the muscles of the uterus, called contractions.; Your health care professional also may also suspect polyhydramnios if your uterus has become large for the number of weeks of pregnancy."
Polymorphous light eruption,https://www.mayoclinic.org/diseases-conditions/polymorphous-light-eruption/symptoms-causes/syc-20355868,"Symptoms of the rash in polymorphous light eruption may include:; Dense clusters of small bumps and blisters.; Inflamed, raised rough patches.; Itching or burning."
Polymyalgia rheumatica,https://www.mayoclinic.org/diseases-conditions/polymyalgia-rheumatica/symptoms-causes/syc-20376539,"The symptoms of polymyalgia rheumatica most often affect both sides of the body. They might include:; Aches or pain in the shoulders.; Aches or pain in the neck, upper arms, buttocks, hips or thighs.; Stiffness in affected areas, mainly in the morning or after not being active for a time.; Less range of motion in affected areas.; Pain or stiffness in the wrists, elbows or knees.; Other symptoms might include:; Mild fever.; Tiredness.; A feeling of not being well, called malaise.; Not wanting to eat.; Weight loss that happens without trying.; Being depressed."
Polymyositis,https://www.mayoclinic.org/diseases-conditions/polymyositis/symptoms-causes/syc-20353208,"The muscle weakness associated with polymyositis involves the muscles closest to the trunk, such as those in your hips, thighs, shoulders, upper arms and neck. The weakness affects both the left and right sides of your body, and tends to gradually worsen."
Popliteal artery aneurysm,https://www.mayoclinic.org/diseases-conditions/popliteal-artery-aneurysm/symptoms-causes/syc-20355432,"You might not notice any symptoms. The first symptom may be pain in the lower leg that occurs with walking, called claudication. Other symptoms of a popliteal artery aneurysm include:; Knee pain.; Lower leg pain.; Swelling behind the knee.; Pulsing feeling behind the knee."
Popliteal artery entrapment,https://www.mayoclinic.org/diseases-conditions/popliteal-artery-entrapment/symptoms-causes/syc-20465211,"The main symptom of popliteal artery entrapment syndrome (PAES) is pain or cramping in the back of the lower leg. The back of the lower leg is called the calf. The pain occurs during exercise and goes away with rest. Other symptoms may include:; Cold feet after exercise.; Tingling or burning in your calf.; Numbness in the calf area.; If the nearby vein, called the popliteal vein, also becomes trapped by the calf muscle, you may have:; A heavy feeling in the leg.; Lower leg cramping at night.; Swelling in the calf area.; Changes in skin color around the calf muscle.; Blood clot in the lower leg, called deep vein thrombosis.; Symptoms typically affect young, otherwise healthy people under age 40."
Porphyria,https://www.mayoclinic.org/diseases-conditions/porphyria/symptoms-causes/syc-20356066,Symptoms can vary widely by type of porphyria and in how severe the symptoms are. Symptoms also can vary among people with the condition. Some people with a gene change that causes porphyria never have any symptoms.
Post-polio syndrome,https://www.mayoclinic.org/diseases-conditions/post-polio-syndrome/symptoms-causes/syc-20355669,"Post-polio syndrome only affects people who had polio. Common signs and symptoms of post-polio syndrome include:; Muscle and joint weakness and pain that gets worse over time; Feeling easily fatigued and exhausted; Losing muscle tissue (atrophy); Breathing or swallowing problems; Sleep-related breathing disorders, such as sleep apnea; Decreased tolerance of cold temperatures; Post-polio syndrome progresses slowly in most people. They may experience new signs and symptoms followed by periods of stability."
Post-traumatic stress disorder (PTSD),https://www.mayoclinic.org/diseases-conditions/post-traumatic-stress-disorder/symptoms-causes/syc-20355967,"Post-traumatic stress disorder symptoms may start within the first three months after a traumatic event. But sometimes symptoms may not appear until years after the event. These symptoms last more than one month and cause major problems in social or work situations and how well you get along with others. They also can affect your ability to do your usual daily tasks.; Generally, PTSD symptoms are grouped into four types: intrusive memories, avoidance, negative changes in thinking and mood, and changes in physical and emotional reactions. Symptoms can vary over time or vary from person to person."
Post-vasectomy pain syndrome,https://www.mayoclinic.org/diseases-conditions/post-vasectomy-pain-syndrome/symptoms-causes/syc-20527047,"Having some discomfort after vasectomy is common, but men with PVPS have pain that never seems to get better after the procedure.; Signs and symptoms of PVPS may include:; Pain and tenderness in the scrotum; Pressure or pain after ejaculation; Dull ache in one or both testicles; Pain and tenderness at the site of the vasectomy; Swelling of the small, C-shaped tube behind the testicle where sperm are stored (epididymis); Pain with sex"
Posterior cortical atrophy,https://www.mayoclinic.org/diseases-conditions/posterior-cortical-atrophy/symptoms-causes/syc-20376560,"Posterior cortical atrophy symptoms vary among people. Symptoms also can vary over time. They tend to gradually get worse. Common symptoms include having trouble with:; Reading, spelling or math.; Driving.; Getting dressed.; Telling the difference between objects that are moving and those that are still.; Judging how far away objects are.; Using everyday objects or tools.; Identifying left from right.; Other common symptoms include:; Anxiety.; Confusion.; Changes in behavior and personality.; Memory problems may occur later in the disease."
Posterior vaginal prolapse (rectocele),https://www.mayoclinic.org/diseases-conditions/rectocele/symptoms-causes/syc-20353414,"A small posterior vaginal prolapse (rectocele) might cause no symptoms.; Otherwise, you may notice:; A soft bulge of tissue in the vagina that might come through the opening of the vagina; Trouble having a bowel movement; Feeling pressure or fullness in the rectum; A feeling that the rectum has not completely emptied after a bowel movement; Sexual concerns, such as feeling embarrassed or sensing looseness in the tone of the vaginal tissue; Many women with posterior vaginal prolapse also have prolapse of other pelvic organs, such as the bladder or uterus. A surgeon can evaluate the prolapse and talk about options for surgery to fix it."
Postherpetic neuralgia,https://www.mayoclinic.org/diseases-conditions/postherpetic-neuralgia/symptoms-causes/syc-20376588,"In general, the symptoms of postherpetic neuralgia are limited to the area of skin where the shingles outbreak first happened. That's commonly in a band around the trunk of the body, most often on one side.; The symptoms might include:; Pain that lasts three months or longer after the shingles rash has healed. The pain may feel burning, sharp and jabbing. Or it may feel deep and aching.; Not being able to stand light touch. People with postherpetic neuralgia often can't bear even the touch of clothing on the affected skin.; Itching or loss of feeling. Less often, postherpetic neuralgia can cause an itchy feeling or numbness."
Postpartum depression,https://www.mayoclinic.org/diseases-conditions/postpartum-depression/symptoms-causes/syc-20376617,"Symptoms of depression after childbirth vary, and they can range from mild to severe."
Postpartum preeclampsia,https://www.mayoclinic.org/diseases-conditions/postpartum-preeclampsia/symptoms-causes/syc-20376646,"Postpartum preeclampsia can be difficult to detect on your own. Many women who experience postpartum preeclampsia show no signs or symptoms during pregnancy. Also, you might not suspect that anything is wrong when you're focused on recovering after childbirth and caring for a newborn.; Signs and symptoms of postpartum preeclampsia — which are typically the same as symptoms of preeclampsia prior to delivery — might include:; High blood pressure (hypertension) — 140/90 millimeters of mercury (mm Hg) or greater; Excess protein in your urine (proteinuria); Severe headaches; Changes in vision, including temporary loss of vision, blurred vision or light sensitivity; Pain in your upper belly, usually under the ribs on the right side; Nausea and vomiting; Shortness of breath; Decreased urination"
Pouchitis,https://www.mayoclinic.org/diseases-conditions/pouchitis/symptoms-causes/syc-20361991,"Symptoms of pouchitis can include diarrhea, belly pain, joint pain, cramps and fever. Other symptoms include passing stool more often, stool leakage at night, trouble controlling stool passage and a strong urge to pass stool."
Prader-Willi syndrome,https://www.mayoclinic.org/diseases-conditions/prader-willi-syndrome/symptoms-causes/syc-20355997,"Symptoms of Prader-Willi syndrome, which can vary, slowly change over time from childhood to adulthood."
Precocious puberty,https://www.mayoclinic.org/diseases-conditions/precocious-puberty/symptoms-causes/syc-20351811,"Precocious puberty symptoms include:; Breast growth and first period in girls.; Testicle and penis growth, facial hair and deeper voice in boys.; Pubic or underarm hair.; Rapid growth.; Acne.; Adult body odor."
Prediabetes,https://www.mayoclinic.org/diseases-conditions/prediabetes/symptoms-causes/syc-20355278,"Prediabetes doesn't usually have any signs or symptoms.; One possible sign of prediabetes is darkened skin on certain parts of the body. Affected areas can include the neck, armpits and groin.; Classic signs and symptoms that suggest you've moved from prediabetes to type 2 diabetes include:; Increased thirst; Frequent urination; Increased hunger; Fatigue; Blurred vision; Numbness or tingling in the feet or hands; Frequent infections; Slow-healing sores; Unintended weight loss"
Preeclampsia,https://www.mayoclinic.org/diseases-conditions/preeclampsia/symptoms-causes/syc-20355745,"The defining feature of preeclampsia is high blood pressure, proteinuria, or other signs of damage to the kidneys or other organs. You may have no noticeable symptoms. The first signs of preeclampsia are often detected during routine prenatal visits with a health care provider.; Along with high blood pressure, preeclampsia signs and symptoms may include:; Excess protein in urine (proteinuria) or other signs of kidney problems; Decreased levels of platelets in blood (thrombocytopenia); Increased liver enzymes that indicate liver problems; Severe headaches; Changes in vision, including temporary loss of vision, blurred vision or light sensitivity; Shortness of breath, caused by fluid in the lungs; Pain in the upper belly, usually under the ribs on the right side; Nausea or vomiting; Weight gain and swelling (edema) are typical during healthy pregnancies. However, sudden weight gain or a sudden appearance of edema — particularly in your face and hands — may be a sign of preeclampsia."
Premature birth,https://www.mayoclinic.org/diseases-conditions/premature-birth/symptoms-causes/syc-20376730,"Your baby may have very mild symptoms of premature birth or more-serious health problems.; Some signs of being born too early include:; Small size, with a head that's large compared with the body.; Features that are sharper and less rounded than a full-term baby's features due to a lack of cells that store fat.; Fine hair that covers much of the body.; Low body temperature, mainly right after birth in the delivery room.; Trouble breathing.; Feeding problems.; The following tables show the median birth weight, length and head circumference of premature babies at different gestational ages for each sex."
