disease_name,url,symptoms
Infertility,https://www.mayoclinic.org/diseases-conditions/infertility/symptoms-causes/syc-20354317,"The main symptom of infertility is not getting pregnant. There may be no other clear symptoms. Some women with infertility may have irregular menstrual periods or no periods. And some men may have some symptoms of hormonal problems, such as changes in hair growth or sexual function.; Many couples eventually will conceive — with or without treatment."
Inflammatory bowel disease (IBD),https://www.mayoclinic.org/diseases-conditions/inflammatory-bowel-disease/symptoms-causes/syc-20353315,Inflammatory bowel disease symptoms vary depending on how bad the inflammation is and where it occurs. Symptoms may range from mild to severe. A person with IBD is likely to have periods of active illness followed by periods of remission.; Symptoms that are common to both Crohn's disease and ulcerative colitis include:; Diarrhea.; Belly pain and cramping.; Blood in the stool.; Loss of appetite.; Losing weight without trying.; Feeling extremely tired.
Inflammatory breast cancer,https://www.mayoclinic.org/diseases-conditions/inflammatory-breast-cancer/symptoms-causes/syc-20355413,"Inflammatory breast cancer doesn't commonly form a lump, as occurs with other forms of breast cancer. Instead, signs and symptoms of inflammatory breast cancer include:; Fast change in the appearance of one breast, over the course of several weeks.; Thickness, heaviness or swelling of one breast.; Changes in skin color, giving the breast a red, purple, pink or bruised appearance.; Unusual warmth of the affected breast.; Dimpling or ridges on the skin of the affected breast, similar to an orange peel.; Tenderness, pain or aching.; Enlarged lymph nodes under the arm, above the collarbone or below the collarbone.; Flattened nipple or nipple that turns inward on the affected breast.; For inflammatory breast cancer to be diagnosed, these symptoms must have been present for less than six months."
Influenza (flu),https://www.mayoclinic.org/diseases-conditions/flu/symptoms-causes/syc-20351719,"The viruses that cause flu spread at high levels during certain times of the year in the Northern and Southern hemispheres. These are called flu seasons. In North America, flu season usually runs between October and May.; Symptoms of the flu such as a sore throat and a runny or stuffy nose are common. You may also get these symptoms with other illness such as a cold. But colds tend to start slowly, and the flu tends to come on quickly, within two or three days after you come in contact with the virus. And while a cold can be miserable, you usually feel much worse with the flu.; Other common flu symptoms include:; Fever.; Cough.; Headache.; Muscle aches.; Feeling very tired.; Sweating and chills.; In children, these symptoms may show up more generally as being fussy or irritable. Children also are more likely than adults to have ear pain, feel sick to the stomach, vomit or have diarrhea with the flu.; In some cases, people have eye pain, watery eyes or find that light hurts their eyes."
Ingrown hair,https://www.mayoclinic.org/diseases-conditions/ingrown-hair/symptoms-causes/syc-20373893,"Signs and symptoms of ingrown hair include:; Tiny, swollen bumps where you shave, tweeze or wax; Small bumps that look like blisters or are filled with pus; Small bumps that are darker than surrounding skin (hyperpigmentation); Burning or stinging; Itching; Hair in the shape of a loop because the tip of the hair curves and grows into the skin"
Ingrown toenails,https://www.mayoclinic.org/diseases-conditions/ingrown-toenails/symptoms-causes/syc-20355903,Ingrown toenail symptoms include:; Pain and tenderness; Inflamed skin; Swelling; Infection
Inguinal hernia,https://www.mayoclinic.org/diseases-conditions/inguinal-hernia/symptoms-causes/syc-20351547,"Inguinal hernia symptoms include:; A bulge in the area on either side of the pubic bone, which becomes more obvious when upright, especially when coughing or straining.; A burning or aching sensation at the bulge.; Pain, discomfort or pressure in the groin, especially when bending over, coughing or lifting.; Occasionally, pain and swelling around the testicles when the protruding intestine descends into the scrotum."
Inherited metabolic disorders,https://www.mayoclinic.org/diseases-conditions/inherited-metabolic-disorders/symptoms-causes/syc-20352590,"There are hundreds of inherited metabolic disorders caused by different genes. Symptoms depend on the type of disorder and how severe it is.; Examples of inherited metabolic disorders include:; Familial hypercholesterolemia.; Gaucher disease.; Hunter syndrome.; Krabbe disease.; Maple syrup urine disease.; Metachromatic leukodystrophy.; Mitochondrial encephalopathy, lactic acidosis, stroke-like episodes (MELAS).; Niemann-Pick.; Phenylketonuria (PKU).; Porphyria.; Tay-Sachs disease.; Wilson's disease."
Insomnia,https://www.mayoclinic.org/diseases-conditions/insomnia/symptoms-causes/syc-20355167,"Insomnia symptoms may include:; Having a hard time falling asleep at night.; Waking up during the night.; Waking up too early.; Feeling tired or sleepy during the day.; Feeling cranky, depressed or anxious.; Having a hard time paying attention, focusing on tasks or remembering.; Making more errors or having more accidents.; Having ongoing worries about sleep."
Intermittent explosive disorder,https://www.mayoclinic.org/diseases-conditions/intermittent-explosive-disorder/symptoms-causes/syc-20373921,"Impulsive attacks and angry outbursts occur suddenly, with little or no warning. They usually last less than 30 minutes. These bouts may occur often or be separated by weeks or months. Verbal outbursts or less severe physical attacks may still occur in between these times. You may be irritable, impulsive, aggressive or angry most of the time.; Before an aggressive bout, you may feel:; Rage.; Irritability.; More tension and energy.; Racing thoughts.; Tingling.; Shaking.; Fast or pounding heartbeat.; Chest tightness.; The explosive verbal and behavioral outbursts are much too intense for the situation, with no thought about what might happen as a result. The outbursts can include:; Temper tantrums.; Long, angry speeches.; Heated arguments.; Shouting.; Slapping, shoving or pushing.; Physical fights.; Property damage.; Threatening or harming people or animals.; You may feel a sense of relief and tiredness after the outburst. Later, you may feel guilty, sorry for your actions or embarrassed."
Interstitial cystitis,https://www.mayoclinic.org/diseases-conditions/interstitial-cystitis/symptoms-causes/syc-20354357,"The signs and symptoms of interstitial cystitis vary from person to person. If you have interstitial cystitis, your symptoms may also vary over time, periodically flaring in response to common triggers, such as menstruation, sitting for a long time, stress, exercise and sexual activity.; Interstitial cystitis signs and symptoms include:; Pain in your pelvis or between the vagina and anus in women; Pain between the scrotum and anus (perineum) in men; Chronic pelvic pain; A persistent, urgent need to urinate; Frequent urination, often of small amounts, throughout the day and night (up to 60 times a day); Pain or discomfort while the bladder fills and relief after urinating; Pain during sex; Symptoms severity is different for everyone, and some people may experience symptom-free periods.; Although signs and symptoms of interstitial cystitis may resemble those of a chronic urinary tract infection, there's usually no infection. However, symptoms may worsen if a person with interstitial cystitis gets a urinary tract infection."
Interstitial lung disease,https://www.mayoclinic.org/diseases-conditions/interstitial-lung-disease/symptoms-causes/syc-20353108,The main symptoms of interstitial lung disease are:; Shortness of breath at rest or shortness of breath that worsens with physical activity.; Dry cough.
Intestinal ischemia,https://www.mayoclinic.org/diseases-conditions/intestinal-ischemia/symptoms-causes/syc-20373946,"Symptoms of intestinal ischemia can come on quickly. When this happens, the condition is called acute intestinal ischemia. When symptoms come on slowly, the condition is called chronic intestinal ischemia. Symptoms may differ from person to person. But certain symptoms suggest a diagnosis of intestinal ischemia."
Intestinal obstruction,https://www.mayoclinic.org/diseases-conditions/intestinal-obstruction/symptoms-causes/syc-20351460,Signs and symptoms of intestinal obstruction include:; Crampy abdominal pain that comes and goes; Loss of appetite; Constipation; Vomiting; Inability to have a bowel movement or pass gas; Swelling of the abdomen
Intracranial hematoma,https://www.mayoclinic.org/diseases-conditions/intracranial-hematoma/symptoms-causes/syc-20356145,"Symptoms of an intracranial hematoma may develop right after a head injury, or they may take weeks or longer to appear. There may be a period of time without symptoms after a head injury. This is called the lucid interval.; Over time, pressure on the brain increases, producing some or all of the following symptoms:; Headache that gets worse.; Vomiting.; Drowsiness and gradual loss of consciousness.; Dizziness.; Confusion.; Pupils that are different sizes.; Slurred speech.; Loss of movement, known as paralysis, on the opposite side of the body from the head injury. As more blood fills the brain or the narrow space between the brain and skull, other symptoms may appear, such as: Feeling very sleepy or sluggish. Seizures. Loss of consciousness.; Loss of movement, known as paralysis, on the opposite side of the body from the head injury.; As more blood fills the brain or the narrow space between the brain and skull, other symptoms may appear, such as:; Feeling very sleepy or sluggish.; Seizures.; Loss of consciousness."
Intracranial venous malformations,https://www.mayoclinic.org/diseases-conditions/intracranial-venous-malformations/symptoms-causes/syc-20353336,"Intracranial venous malformations may never cause symptoms. They are sometimes found by accident during brain imaging tests for another condition. If an intracranial venous malformation does cause symptoms, they may include:; Headaches.; Seizures.; Dizziness.; Nausea and vomiting.; Muscle weakness or paralysis.; Loss of coordination.; Vision troubles.; Difficulty speaking.; Memory problems."
Intussusception,https://www.mayoclinic.org/diseases-conditions/intussusception/symptoms-causes/syc-20351452,
Invasive lobular carcinoma,https://www.mayoclinic.org/diseases-conditions/invasive-lobular-carcinoma/symptoms-causes/syc-20373973,"At first, invasive lobular carcinoma may cause no signs and symptoms. As it grows larger, invasive lobular carcinoma may cause:; A change in the texture or appearance of the skin over the breast, such as dimpling or thickening.; A new area of fullness or swelling in the breast.; A newly inverted nipple.; An area of thickening in part of the breast.; Invasive lobular carcinoma is less likely to cause a firm or distinct breast lump than other types of breast cancer."
Iritis,https://www.mayoclinic.org/diseases-conditions/iritis/symptoms-causes/syc-20354961,"Iritis can occur in one or both eyes. It usually develops suddenly, and can last up to three months.; Signs and symptoms of iritis include:; Eye redness; Discomfort or achiness in the affected eye; Sensitivity to light; Decreased vision; Iritis that develops suddenly, over hours or days, is known as acute iritis. Symptoms that develop gradually or last longer than three months indicate chronic iritis."
Iron deficiency anemia,https://www.mayoclinic.org/diseases-conditions/iron-deficiency-anemia/symptoms-causes/syc-20355034,"Initially, iron deficiency anemia can be so mild that it goes unnoticed. But as the body becomes more deficient in iron and anemia worsens, the signs and symptoms intensify.; Iron deficiency anemia signs and symptoms may include:; Extreme fatigue; Weakness; Pale skin; Chest pain, fast heartbeat or shortness of breath; Headache, dizziness or lightheadedness; Cold hands and feet; Inflammation or soreness of your tongue; Brittle nails; Unusual cravings for non-nutritive substances, such as ice, dirt or starch; Poor appetite, especially in infants and children with iron deficiency anemia"
Irritable bowel syndrome,https://www.mayoclinic.org/diseases-conditions/irritable-bowel-syndrome/symptoms-causes/syc-20360016,"Symptoms of IBS vary but are usually present for a long time. The most common include:; Belly pain, cramping or bloating that is related to passing stool.; Changes in appearance of stool.; Changes in how often you are passing stool.; Other symptoms that are often related include sensation of incomplete evacuation and increased gas or mucus in the stool."
Ischemic colitis,https://www.mayoclinic.org/diseases-conditions/ischemic-colitis/symptoms-causes/syc-20374001,"Symptoms of ischemic colitis can include:; Pain, tenderness or cramping in the belly, which can happen suddenly or happen over time.; Bright red or maroon blood in the stool or, at times, passage of blood alone without stool.; A feeling of urgency to move the bowels.; Diarrhea.; Nausea.; The risk of serious complications is higher when symptoms happen on the right side of the belly. This is less commonly seen compared with left-sided colitis. People with right-sided colitis tend to have more underlying medical conditions, such as high blood pressure, atrial fibrillation and kidney disease. They more often have to undergo surgery and also have a higher risk of death."
Itchy skin (pruritus),https://www.mayoclinic.org/diseases-conditions/itchy-skin/symptoms-causes/syc-20355006,"Itchy skin can affect small areas, such as the scalp, an arm or a leg. Or it can cover the whole body. Itchy skin can occur without any other noticeable changes on the skin. Or it may come with:; Inflamed skin; Scratch marks; Bumps, spots or blisters; Dry, cracked skin; Leathery or scaly patches; Sometimes itchiness lasts a long time and can be intense. As you rub or scratch the area, it gets itchier. And the more it itches, the more you scratch. Breaking this itch-scratch cycle can be difficult."
Jaw tumors and cysts,https://www.mayoclinic.org/diseases-conditions/jaw-tumors-cysts/symptoms-causes/syc-20350973,"A tumor is an abnormal growth or mass of tissue. A cyst is a lesion that contains liquid or semisolid material. Examples of jaw tumors and cysts include:; Ameloblastoma. This rare, usually noncancerous (benign) tumor begins in the cells that form the protective enamel lining on the teeth. It develops most often in the jaw near the molars. The most common type is aggressive, forming large tumors and growing into the jawbone. Although this tumor can recur after treatment, aggressive surgical treatment will typically reduce the chance of recurrence.; Central giant cell granuloma. Central giant cell granulomas are benign lesions that grow from bone cells. They most often occur in the front portion of the lower jaw. One type of these tumors can grow rapidly, cause pain and destroy bone, and has a tendency to recur after surgical treatment. The other type is less aggressive and may not have symptoms. Rarely, a tumor may shrink or resolve on its own, but typically these tumors require surgical treatment.; Dentigerous cyst. This cyst originates from tissue that surrounds a tooth before it erupts into the mouth. This is the most common form of cyst that affects the jaws. Most often these cysts will occur around wisdom teeth that are not fully erupted, but they can also involve other teeth.; Odontogenic keratocyst. This cyst is also referred to as a keratocystic odontogenic tumor because of its tumorlike tendency to recur after surgical treatment. Although this cyst is typically slow growing, it can still be destructive to the jaw and teeth if left untreated over a long period of time. Most often the cyst develops in the lower jaw near the third molars. These cysts may also be found in people with an inherited condition called nevoid basal cell carcinoma syndrome.; Odontogenic myxoma. This is a rare, slow-growing, benign tumor that occurs most often in the lower jaw. The tumor can be large and aggressively invade the jaw and surrounding tissue and displace teeth. Odontogenic myxomas are known to recur after surgical treatment; however, the chances of tumor recurrence are typically lessened by more-aggressive forms of surgical treatment.; Odontoma. This benign tumor is the most common odontogenic tumor. Odontomas often have no symptoms, but they may interfere with tooth development or eruption. Odontomas are made up of dental tissue that grows around a tooth in the jaw. They can resemble an oddly shaped tooth or can be a small or large calcified tumor. These tumors may be part of some genetic syndromes.; Other types of cysts and tumors. These include adenomatoid odontogenic tumor, calcifying epithelial odontogenic tumor, glandular odontogenic cyst, squamous odontogenic tumor, calcifying odontogenic cyst, cementoblastoma, aneurysmal bone cyst, ossifying fibroma, osteoblastoma. central odontogenic fibroma and others."
Jellyfish stings,https://www.mayoclinic.org/diseases-conditions/jellyfish-stings/symptoms-causes/syc-20353284,"Symptoms of jellyfish stings include:; Burning, prickling, stinging pain; Welts or tracks on the skin — a ""print"" of the tentacles' contact with the skin; Itchiness (pruritus); Swelling; Throbbing pain that radiates up a leg or an arm; Severe jellyfish stings can affect multiple body systems. These reactions may appear rapidly or several hours after the stings. Symptoms of severe jellyfish stings include:; Stomach pain, nausea and vomiting; Headache; Muscle pain or spasms; Faintness, dizziness or confusion; Difficulty breathing; Heart problems; The severity of a reaction depends on:; The type and size of the jellyfish; The age, size and health of the person affected, with severe reactions more likely in children; How long the person was exposed to the stingers; How much of the skin is affected"
Jet lag disorder,https://www.mayoclinic.org/diseases-conditions/jet-lag/symptoms-causes/syc-20374027,Symptoms of jet lag can vary. You may experience only one symptom or you may have many. Jet lag symptoms may include:; Sleep problems such as not being able to fall asleep or waking up early.; Daytime fatigue.; Not being able to focus or function at your usual level.; Stomach problems such as constipation or diarrhea.; A general feeling of not being well.; Mood changes.
Jock itch,https://www.mayoclinic.org/diseases-conditions/jock-itch/symptoms-causes/syc-20353807,"Symptoms of jock itch are:; A spreading rash that begins in the crease of the groin and moves down the upper thigh and buttocks.; A rash whose center tends to clear as the rash spreads.; A rash that may be full or partially ring shaped.; A rash bordered with small blisters.; Itchiness.; Scaly skin.; A rash that might be red, brown, purple or gray depending on your skin color."
Juvenile idiopathic arthritis,https://www.mayoclinic.org/diseases-conditions/juvenile-idiopathic-arthritis/symptoms-causes/syc-20374082,"The most common signs and symptoms of juvenile idiopathic arthritis are:; Pain. While your child might not complain of joint pain, you may notice that he or she limps — especially first thing in the morning or after a nap.; Swelling. Joint swelling is common but is often first noticed in larger joints such as the knee.; Stiffness. You might notice that your child appears clumsier than usual, particularly in the morning or after naps.; Fever, swollen lymph nodes and rash. In some cases, high fever, swollen lymph nodes or a rash on the trunk may occur — which is usually worse in the evenings.; Juvenile idiopathic arthritis can affect one joint or many. There are several different subtypes of juvenile idiopathic arthritis, but the main ones are systemic, oligoarticular and polyarticular. Which type your child has depends on symptoms, the number of joints affected, and if a fever and rashes are prominent features.; Like other forms of arthritis, juvenile idiopathic arthritis is characterized by times when symptoms flare up and times when symptoms may be minimal."
Kaposi sarcoma,https://www.mayoclinic.org/diseases-conditions/kaposis-sarcoma/symptoms-causes/syc-20577303,"Kaposi sarcoma signs and symptoms include:; A growth on the skin that may be raised or flat.; A growth on the skin that looks red, purple or brown in color.; The growths, called lesions, most often happen on the face, arms or legs. They usually don't cause discomfort.; If Kaposi sarcoma isn't treated, the lesions can get bigger. They may cause:; Swelling in the lower legs caused by blood flow problems.; Enlarged lymph nodes.; Skin that appears red or purple in color and may be painful and itchy.; Kaposi sarcoma also can affect areas you can't see. It can grow in the digestive tract or lungs. When Kaposi sarcoma happens in the digestive tract, symptoms may include:; Diarrhea.; Nausea.; Stomach pain.; Vomiting.; Weight loss."
Kawasaki disease,https://www.mayoclinic.org/diseases-conditions/kawasaki-disease/symptoms-causes/syc-20354598,"Symptoms of Kawasaki disease include a fever greater than 102.2 degrees Fahrenheit (39 degrees Celsius) for five or more days. And the child has at least four of the following symptoms.; A rash on the main part of the body or in the genital area.; An enlarged lymph node in the neck.; Very red eyes without a thick discharge.; Red, dry, cracked lips and a red, swollen tongue.; Swollen, red skin on the palms of the hands and the soles of the feet. Later the skin on fingers and toes peels.; The symptoms might not happen at the same time. Let your child's healthcare professional know about a symptom that has gone away.; Other symptoms might include:; Belly pain.; Diarrhea.; Fussiness.; Joint pain.; Vomiting.; Some children get a high fever for five or more days but have fewer than four of the symptoms needed for a diagnosis of Kawasaki disease. They might have what's called incomplete Kawasaki disease. Children with incomplete Kawasaki disease are still at risk of damage to the heart arteries. They still need treatment within 10 days of when symptoms appear.; Kawasaki disease can have symptoms like those of a condition called multisystem inflammatory syndrome in children. The syndrome happens in children with COVID-19."
Keloid scar,https://www.mayoclinic.org/diseases-conditions/keloid-scar/symptoms-causes/syc-20520901,"A keloid scar may form within months to years of the inciting injury. Signs and symptoms might include:; Thick, irregular scarring, typically on the earlobes, shoulders, cheeks or middle chest; Shiny, hairless, lumpy, raised skin; Varied size, depending on the size of the original injury and when the keloid stops growing; Varied texture, from soft to firm and rubbery; Reddish, brown or purplish, depending on your skin color; Itchiness; Discomfort"
Keratitis,https://www.mayoclinic.org/diseases-conditions/keratitis/symptoms-causes/syc-20374110,"Symptoms of keratitis include:; Eye redness; Eye pain; Excess tears or other discharge from your eye; Difficulty opening your eyelid because of pain or irritation; Blurred vision; Decreased vision; Sensitivity to light, called photophobia; A feeling that something is in your eye"
Keratoconus,https://www.mayoclinic.org/diseases-conditions/keratoconus/symptoms-causes/syc-20351352,"Symptoms of keratoconus may change as the disease progresses. They include:; Blurred or distorted vision.; Increased sensitivity to bright light and glare, which can cause problems with night driving.; A need for frequent changes in eyeglass prescriptions.; Sudden worsening or clouding of vision."
Keratosis pilaris,https://www.mayoclinic.org/diseases-conditions/keratosis-pilaris/symptoms-causes/syc-20351149,"Keratosis pilaris can occur at any age, but it's more common in young children. Symptoms include:; Painless tiny bumps on the upper arms, thighs, cheeks or buttocks; Dry, rough skin in the areas with bumps; Worsening when seasonal changes cause low humidity and dry skin; Sandpaper-like bumps resembling goose flesh"
Kidney cancer,https://www.mayoclinic.org/diseases-conditions/kidney-cancer/symptoms-causes/syc-20352664,"Kidney cancer doesn't usually cause symptoms at first. In time, signs and symptoms may develop, including:; Blood in the urine, which may appear pink, red or cola colored.; Loss of appetite.; Pain in the side or back that doesn't go away.; Tiredness.; Unexplained weight loss."
Kidney cysts,https://www.mayoclinic.org/diseases-conditions/kidney-cysts/symptoms-causes/syc-20374134,"Simple kidney cysts typically don't cause symptoms. But if a simple kidney cyst grows large enough, symptoms may include:; Dull pain in the back or side; Fever; Upper stomach pain"
Kidney infection,https://www.mayoclinic.org/diseases-conditions/kidney-infection/symptoms-causes/syc-20353387,"Symptoms of a kidney infection might include:; Fever; Chills; A burning feeling or pain when urinating; Having to urinate often; A strong, lasting urge to urinate; Back, side or groin pain; Nausea and vomiting; Pus or blood in the urine; Urine that smells bad or is cloudy; Belly pain"
Kidney stones,https://www.mayoclinic.org/diseases-conditions/kidney-stones/symptoms-causes/syc-20355755,
Kleptomania,https://www.mayoclinic.org/diseases-conditions/kleptomania/symptoms-causes/syc-20364732,"Kleptomania symptoms may include:; Inability to resist powerful urges to steal items that you don't need; Feeling increased tension, anxiety or arousal leading up to the theft; Feeling pleasure, relief or satisfaction while stealing; Feeling terrible guilt, remorse, self-loathing, shame or fear of arrest after the theft; Return of the urges and a repetition of the kleptomania cycle"
